[
  {"schema":"privileged-bridge-status-v1","observed_at":"2026-09-13T02:00:00Z","state":"not-entitled","event_gap":true,"dropped_events":0,"fallback":{"active":true,"method":"snapshot-fsevents","maximum_confidence":"inferred"},"retry":{"automatic":false,"minimum_seconds":60,"maximum_seconds":3600,"requires_user_action":true},"limitations":["Apple Endpoint Security entitlement is absent; fallback monitoring remains active."]},
  {"schema":"privileged-bridge-status-v1","observed_at":"2026-09-13T02:01:00Z","state":"not-permitted","event_gap":true,"dropped_events":0,"fallback":{"active":true,"method":"snapshot-fsevents","maximum_confidence":"inferred"},"retry":{"automatic":false,"minimum_seconds":60,"maximum_seconds":3600,"requires_user_action":true},"limitations":["Full Disk Access is not granted; fallback monitoring remains active."]},
  {"schema":"privileged-bridge-status-v1","observed_at":"2026-09-13T02:02:00Z","state":"unavailable","event_gap":true,"dropped_events":0,"fallback":{"active":true,"method":"snapshot-fsevents","maximum_confidence":"unknown"},"retry":{"automatic":true,"minimum_seconds":5,"maximum_seconds":300,"requires_user_action":false},"limitations":["The extension is unavailable; exact provenance is disabled."]},
  {"schema":"privileged-bridge-status-v1","observed_at":"2026-09-13T02:03:00Z","state":"dropped-events","event_gap":true,"dropped_events":42,"fallback":{"active":true,"method":"snapshot-fsevents","maximum_confidence":"unknown"},"retry":{"automatic":true,"minimum_seconds":5,"maximum_seconds":300,"requires_user_action":false},"limitations":["Sequence loss creates an attribution gap; exact claims are forbidden across the gap."]},
  {"schema":"privileged-bridge-status-v1","observed_at":"2026-09-13T02:04:00Z","state":"overloaded","event_gap":true,"dropped_events":1200,"fallback":{"active":true,"method":"snapshot-fsevents","maximum_confidence":"unknown"},"retry":{"automatic":true,"minimum_seconds":10,"maximum_seconds":600,"requires_user_action":false},"limitations":["Bounded queue overflow dropped metadata; fallback sampling remains active."]}
]
